{
  "$schema": "https://json-schema.org/draft/2020-12/schema",
  "$id": "https://flowly.local/contracts/schemas/budget.schema.json",
  "title": "Budget",
  "type": "object",
  "additionalProperties": false,
  "required": [
    "formatVersion",
    "id",
    "name",
    "amountMinor",
    "currency",
    "period",
    "startDate",
    "rollover",
    "active",
    "createdAt",
    "updatedAt"
  ],
  "properties": {
    "formatVersion": { "const": 1 },
    "id": { "type": "string", "format": "uuid" },
    "name": { "type": "string", "minLength": 1, "maxLength": 80 },
    "amountMinor": { "type": "integer", "minimum": 1 },
    "currency": { "type": "string", "pattern": "^[A-Z]{3}$" },
    "period": { "enum": ["weekly", "monthly", "quarterly", "yearly", "custom"] },
    "startDate": { "type": "string", "format": "date" },
    "endDate": { "type": "string", "format": "date" },
    "accountIds": {
      "type": "array",
      "uniqueItems": true,
      "items": { "type": "string", "format": "uuid" }
    },
    "tagIds": {
      "type": "array",
      "uniqueItems": true,
      "items": { "type": "string", "format": "uuid" }
    },
    "rollover": { "type": "boolean" },
    "active": { "type": "boolean" },
    "createdAt": { "type": "string", "format": "date-time" },
    "updatedAt": { "type": "string", "format": "date-time" }
  }
}
