{
  "formatVersion": 1,
  "id": "018f2c1e-6d5b-7c3a-9f2e-5c4d5e6f7081",
  "name": "Groceries",
  "amountMinor": 40000,
  "currency": "EUR",
  "period": "monthly",
  "startDate": "2026-09-01",
  "tagIds": ["018f2c1e-6d5b-7c3a-9f2e-3c4d5e6f7081"],
  "rollover": false,
  "active": true,
  "createdAt": "2026-09-01T08:00:00.000Z",
  "updatedAt": "2026-09-01T08:00:00.000Z"
}
